<?xml version="1.0" encoding="UTF-8"?>
<!DOCTYPE session  PUBLIC "-//Tricklab//DTD Session V1.0//EN" "../../XML/DTD/Session.dtd">
<session version="1.0" presentation="SIMPLE" mode="table">
    <tstart>500.0</tstart>
    <tstop>80000.0</tstop>
    <frequency>50.0</frequency>
    <run>
        <dir>../TEST_DATA/RUN_ASCII</dir>
    </run>
    <product_files>
        <file>product_8.xml</file>
    </product_files>
</session>
