<?xml version="1.0" encoding="ISO-8859-1"?>
<!DOCTYPE session  PUBLIC "-//Tricklab//DTD Session V1.0//EN" "../../XML/DTD/Session.dtd">
<session version="1.0" presentation="comparison">
    <tstart>0</tstart>
    <tstop>86400</tstop>
    <frequency>50.0</frequency>
    <run> <dir>../TEST_DATA/BUNCHORUNS/RUN5</dir> </run>
    <run> <dir>../TEST_DATA/BUNCHORUNS/RUN6</dir> </run>
    <product_files>
        <file>product_9.xml</file>
    </product_files>
</session>
