<?xml version="1.0" encoding="ISO-8859-1"?>
<!DOCTYPE session  PUBLIC "-//Tricklab//DTD Session V1.0//EN" "../../XML/DTD/Session.dtd">
<!-- This is an XML comment -->
<session version="1.0" presentation="simple">
    <tstart>0.0</tstart>
    <tstop>86400</tstop>
    <frequency>50.0</frequency>
    <run timename="s_simtime">
        <dir>../TEST_DATA/RUN_MATLAB</dir>
    </run>
    <product_files>
        <file>product_mat.xml</file>
    </product_files>
</session>
