<?xml version="1.0" encoding="ISO-8859-1"?>
<!DOCTYPE session  PUBLIC "-//Tricklab//DTD Session V1.0//EN" "../../XML/DTD/Session.dtd">
<session version="1.0" presentation="DELTA">
    <tstart>0.0</tstart>
    <tstop>86400.0</tstop>
    <frequency>50.0</frequency>
    <run>
        <dir>../TEST_DATA/RUN_BINARY</dir>
    </run>
    <run>
    	<dir>../TEST_DATA/RUN_ASCII</dir>
    </run>
    <product_files>
        <file>product_4.xml</file>
    </product_files>
</session>
